<?xml version="1.0" encoding="utf-8"?>
<hipertext xmlns:xsi="http://www.w3.org/2001/XMLSchema-instance"
   xsi:noNamespaceSchemaLocation="HH.xsd">
	<definition>Hipertext is a nonlinear text material.</definition>
	<history>
		<person>
			<name></name>
			<surname></surname>
		</person>
		<person>
			<name></name>
			<surname></surname>
		</person>
	</history>
	<course>
		<student>
			<name>Tim</name>
			<surname>Schopinski</surname>
		</student>
		<classes>
			<component id ="1">
				<topic>Hypertext &amp; hypermedia</topic>
				<theme>Hypertext &amp; hypermedia</theme>
				<theme>HTML CSS</theme>
				<theme>XML</theme>
				<theme>XML Schema</theme>
				<theme>DTD</theme>
				<theme>XSLT</theme>
				<score>30</score>
			</component>
		</classes>
		<information>
			<links>
				<link source=""</link>
				<link source=""</link>
				<link source=""</link>
			</links>
		</information>
	</course>
</hipertext>